Unnamed: 0,questions,answers,similarity_score
734,What action can the Association take if a member refuses to recognize an Original Inspection after agreeing to be governed by it?,"The Association can suspend service to the member, as specified in the By Laws.",0.868262339097355
735,When can an Original Inspection be considered repudiated?,An Original Inspection can be considered repudiated if the buyer fails to settle in full for the shipment without applying for a re-inspection.,0.9077232368481756
736,What are the requirements for repudiation of an Original Inspection made at destination?,"For repudiation to occur, the buyer must fail to settle in full for the portion of the shipment that meets the specifications of the order, which must amount to at least 30% of the total footage of the shipment.",0.9077232368481756
737,What options are available for lumber not up to the specifications in an Original Inspection?,The lumber may be held for the seller's disposition or accepted with any agreed-upon adjustment between the buyer and seller.,0.885904871947128
738,What should the buyer do when an Original Inspection is conducted at destination by agreement?,The buyer should protect the seller's right to re-inspection by preserving the official NHLA seal from each bundle of lumber and giving the seller an opportunity to order re-inspection before using any part of the shipment.,0.9013942390653634
739,Which lumber thickness is subject to grading and measurement by a National Inspector only at declaration?,"Lumber 5/4"" thick or thicker is subject to grading and measurement by a National Inspector only at declaration.",0.9399595341281495
740,Do the regulations regarding grading and measurement by a National Inspector only at declaration apply to all types of lumber?,"No, the regulations apply especially but not solely to lumber bulk piled at shipping point.",0.9399595341281495
741,What is the purpose of measuring lumber in the forestry industry?,Measuring lumber is done to determine the dimensions and quantities of lumber for trading and construction purposes.,0.9009335033710412
742,What are some characteristics of Virginia pine?,"Virginia pine is intolerant of shade, has a moderate growth rate, and is a hard pine.",0.9999999999999998
743,How tall does Virginia pine grow?,Virginia pine grows to a height of 40 to 60 feet.,0.9999992036348979
744,What is the diameter of a mature Virginia pine?,A mature Virginia pine attains a diameter of 1 to 1.5 feet.,1.0
745,What is Virginia pine often grown for in the southern states?,Virginia pine is often grown for Christmas trees.,1.0
746,What is the purpose of the Financial Guarantee in forestry?,The Financial Guarantee is used to provide assurance of payment for claims.,0.9049081387691962
747,When should claims for payment under the Financial Guarantee be presented?,Claims should be presented within 30 days after the date of Official Re-inspection.,0.8942636577619555
748,What expenses will the Association cover for approved claims on the four percent money value claim?,"The Association will cover labor costs for handling the re-inspected lumber at actual cost or $15.00 per M feet, whichever is less.",0.8458319241321595
749,What are some limitations on the applicability of the Financial Guarantee?,All limitations stated in the Original Inspection Regulations are incorporated and made a part of the Financial Guarantee.,0.9225289979556377
750,What defects are considered during the Official Re-inspection of seal strapped and sealed shipments?,"Defects such as warp, stain, and checks are considered during the Official Re-inspection.",0.856393911067507
751,Under what circumstances does the Financial Guarantee apply to lumber loaded on open rail cars and open trucks?,"The Financial Guarantee applies to lumber loaded on open rail cars and open trucks, except for specific defects ordered by the buyer.",0.9192055199698572
752,What are some contingencies that shipments under this code are subject to?,"Shipments under this code are subject to contingencies such as fines, floods, strikes, delays of carriers, acts of God, or other conditions beyond the control of the contracting parties.",0.865383734808653
753,What is the requirement for making a claim for relief regarding contingencies?,A claim for relief regarding contingencies must be made in good faith and supported by satisfactory evidence that the failure to discharge contractual obligations is solely due to the operation of the contingency or other conditions beyond the control of the contracting parties.,0.9488507255830207
754,What does the term 'F.O.B. destination' or 'Freight allowed to destination' include?,The term 'F.O.B. destination' or 'Freight allowed to destination' includes only the handful line hall charge in effect on the date of operation.,0.8538382007844305
755,"Who is responsible for paying switching charges, terminal charges, and tax on freight and duty assessed on goods?","Unless otherwise stipulated, the buyer is responsible for paying switching charges, terminal charges, and tax on freight and duty assessed on goods. However, if these charges result from the seller's negligence in not conforming to the shipping instructions, then the seller is responsible for payment.",0.8667399808939247
756,What liability does the seller assume when the price is agreed upon for delivery at destination?,"When the price is agreed upon for delivery at destination, the seller assumes all liability for any increase in freight rates and receives the benefit arising from any reduction in freight rate.",0.9616940252175399
757,What liability does the buyer assume when the price is agreed upon at the shipping point?,"When the price is agreed upon at the shipping point, the buyer assumes all liability for any increase in freight rate and receives the benefit arising from any reduction in freight rate.",0.9616940252175399
758,What are the current rules for grading and measurement of the National Hardwood Number Association?,The current rules for grading and measurement of the National Hardwood Number Association apply to the number sold under this code.,0.8947937450756269
759,What type of inspection does the code provide for?,The code provides for both Original Inspection and Re-inspection regulated by the Original Inspection Regulations and the Re-inspection Regulations.,0.8915740388355943
760,How should a claim for relief arising from the operation of contingencies be made?,A claim for relief arising from the operation of contingencies must be made in good faith and supported by satisfactory evidence.,0.9488507255830207
761,Who is responsible for payment if the seller neglects to conform to shipping instructions?,"If the seller neglects to conform to shipping instructions, the seller assumes the payment of charges that have accrued due to his neglect.",0.8832408915353616
762,What is the purpose of forestry?,"Forestry is the practice of managing and cultivating forests for various purposes such as timber production, conservation, and ecosystem services.",0.9049081387691962
763,What are some common characteristics of Virginia pine?,"Virginia pine is intolerant of shade, has a moderate growth rate, and is a hard pine.",0.9915679576222498
764,How tall does Virginia pine grow?,Virginia pine grows to a height of 40 to 60 feet.,0.9999999999999992
765,What is the diameter of a mature Virginia pine?,A mature Virginia pine attains a diameter of 1 to 1.5 feet.,1.0
766,What is Virginia pine often grown for in the southern states?,Virginia pine is often grown for Christmas trees.,1.0
767,What is the process of plain sawing in forestry?,"Plain sawing is a method of cutting lumber where the log is cut parallel to the growth rings, resulting in a wider variety of grain patterns.",0.8632414144700412
768,What is the purpose of industrial blocking in forestry?,"Industrial blocking is the process of creating large, standardized pieces of wood used in the construction of industrial facilities and equipment.",0.882843263195841
769,What are inspection fees in forestry?,Inspection fees are charges imposed for the evaluation and assessment of forestry practices to ensure compliance with regulations and standards.,0.8851074957619314
770,What is the standard measurement and tally method in forestry?,The standard measurement and tally method in forestry is a system of measuring and recording the quantity and quality of harvested timber.,0.8942481762789721
771,What are military timbers in forestry?,"Military timbers are specially cut and treated wood used in the construction of military structures, such as barracks and defense fortifications.",0.8824924913571695
772,What are some characteristics of Virginia pine?,"Virginia pine is intolerant of shade, has a moderate growth rate, and is a hard pine.",0.9999999999999998
773,How tall does Virginia pine grow?,Virginia pine grows to a height of 40 to 60 feet.,0.9999999999999992
774,What is the diameter of a mature Virginia pine?,A mature Virginia pine attains a diameter of 1 to 1.5 feet.,1.0
775,What is Virginia pine often grown for in the southern states?,Virginia pine is often grown for Christmas trees.,1.0
776,What are some tips and shortcuts in forestry?,"Some tips and shortcuts in forestry include determining 2/3 the width of the board using the lumber scale, calculating the value for upgrading by obtaining the percentage difference between lumber pieces and dividing 100 by the surface measure, and deducting the amount of side bend in a board when taking full length cuttings.",0.8739807610062423
777,How do you determine 2/3 the width of a board?,"To determine 2/3 the width of a board, use the 16' scale on the lumber scale and divide by 2.",0.948409393694253
778,How do you calculate the value for upgrading?,"To calculate the value for upgrading, obtain the percentage difference between lumber pieces, then divide 100 by the surface measure.",0.8232825595453992
779,What should be considered when reducing the surface measure percentage?,"When reducing the surface measure percentage, do not exceed the percentage difference of the pieces.",0.8667701534498011
780,How do you determine the amount of side bend in a board?,"To determine the amount of side bend in a board, stand the board on its edge and measure the bend as its greatest distance from a straight line.",0.886013846234933
781,"What is the maximum width of a full length cutting for a board with a 1-inch bend, 6 inches wide, and 10 inches long?","The maximum width of a full length cutting for a board with a 1-inch bend, 6 inches wide, and 10 inches long is 5 inches.",0.8958871242725736
782,What is the requirement for each cutting of Red Birch?,Each required cutting of Red Birch shall have one clear heartwood face.,0.8805985641945003
783,What is the standard for FAS grade of Red Birch?,"For Red Birch, the standard for FAS grade is width 5* and wider; pieces 5* wide containing 3' and 4' surface measure shall be clear, pieces 5* wide containing 5' in 7' surface measure shall yield 11/12 (91-2/3%) clear face in one cutting.",0.9270711384162663
784,What is the grading standard for Hard Maple?,"The grading standards for Hard Maple include FAS, F1F, SELECTS, NO. 1 COMMON, NO. 2A COMMON, NO. 3A COMMON, NO. 2B COMMON, and NO. 3B COMMON.",0.9374385277003955
785,What should be specified when referring to Sap Birch?,"When referring to Sap Birch, each required cutting shall have one clear sapwood face.",0.8955128395328424
786,What is the standard for FAS grade of Sap Hard Maple?,"For Sap Hard Maple, the standard for FAS grade is width 5* and wider; pieces 5* wide containing 3' and 4' surface measure shall be clear, pieces 5* wide containing 5' to 7' surface measure shall yield 11/12 (91-2/3%) clear face in one cutting.",0.9374385277003955
787,What should be specified when referring to White Maple?,Orders for White Maple should specify Hard Maple or Soft Maple.,0.8955128395328424
788,What is the difference between No. 1 White Maple and No. 2 White Maple?,"No. 1 White Maple requires both faces and both edges of the required cuttings to be sapwood, while No. 2 White Maple requires one face and both edges with the reverse side not less than 50% sapwood.",0.8869363743432642
789,What are some characteristics of Virginia pine?,"Virginia pine is intolerant of shade, has a moderate growth rate, and is a hard pine.",0.9999991431371007
790,How tall does Virginia pine grow?,Virginia pine grows to a height of 40 to 60 feet.,0.9999999999999992
791,What is the diameter of a mature Virginia pine?,A mature Virginia pine attains a diameter of 1 to 1.5 feet.,1.0
792,What is Virginia pine often grown for in the southern states?,Virginia pine is often grown for Christmas trees.,1.0
793,What is the characteristic grain pattern of ribbon stripe wood?,Ribbon stripe wood has a stripe effect caused by quarter sawing.,0.8522698382318683
794,What is the marking and color tone requirement for quartered red gum wood?,Each piece of quartered red gum wood should have marking and color tones producing a variegated effect on the surface.,0.933979120639685
795,"What is the grading standard for Aspen wood of EAS, F1E, SELECTS, and NO. 1 COMMON?",Standard.,0.9541352174855563
796,What is the grading standard for NO. 2A COMMON Aspen wood?,Standard except stain is admitted.,0.9296638953172222
797,"What is the grading standard for American Chestnut wood of EAS, F1E, SELECTS, and NO. 1 COMMON?","Standard, except that worm holes and stain shall be admitted without limit.",0.9541352174855563
798,What is the admission standard for sound knots in SOUND WORMY American Chestnut wood?,The size of sound knots admitted is not limited.,0.8756599671553458
799,What are some characteristics of No. 3 Common Timbers?,"No. 3 Common Timbers have cancer defects like coarse peck and occasional knot holes, but each piece is sufficient for use as ground silk and low cost building material.",0.9160033127548465
800,What are the width and length requirements for FAS grade Mesquite?,"The widths for FAS grade Mesquite are 6 inches and greater, and the lengths are 4 inches and greater.",0.9557706528528619
801,What is the minimum size of cuttings for FAS grade Mesquite?,The minimum size of cuttings for FAS grade Mesquite is 4 inches wide by 24 inches long.,0.9643415296140186
802,How is the grading done for FAS grade Mesquite?,"Grading for FAS grade Mesquite is made on the percent face of the board, with at least 83% of surface measure present as clear-face cuttings.",0.9384530300569875
803,What are the width and length requirements for Selicit grade Mesquite?,"The widths for Selicit grade Mesquite are 4 inches and greater, and the lengths are 5 inches and greater.",0.9557706528528619
804,What is the minimum size of cuttings for Selicit grade Mesquite?,The minimum size of cuttings for Selicit grade Mesquite is 2.5 inches wide by 18 inches long.,0.9643415296140186
805,How is the grading done for Selicit grade Mesquite?,"Grading for Selicit grade Mesquite is made on the clearest face, with at least 83% of surface measure present as clear-face cuttings.",0.9384530300569875
806,What are the width and length requirements for No. 1 Common grade Mesquite?,"The widths for No. 1 Common grade Mesquite are 2 inches and greater, and the lengths are 2 feet and greater.",0.952113145111398
807,What is the minimum size of cuttings for No. 1 Common grade Mesquite?,The minimum size of cuttings for No. 1 Common grade Mesquite is 1.5 inches wide by 6 inches long.,0.9554601901529804
808,How is the grading done for No. 1 Common grade Mesquite?,"Grading for No. 1 Common grade Mesquite is made on the facet, with at least 50% of surface measure present as clear-face cuttings.",0.9287524460286322
809,What are the standards for Virginia pine?,Virginia pine has specific standards for its growth and appearance.,0.9235544999249976
810,What is the maximum height for Virginia pine?,Virginia pine can grow up to 40 to 60 feet tall.,0.9717138460192897
811,What is the diameter of a mature Virginia pine?,A mature Virginia pine can have a diameter of 1 to 1.5 feet.,1.0
812,What is Virginia pine commonly used for in the southern states?,Virginia pine is often grown for Christmas trees.,0.9851140841787975
813,What is the allowable defect in Virginia pine pieces?,"Defects in Virginia pine are allowed within certain limits, such as sapwood on the face side or other defects in the reverse side.",0.9090753520695352
814,What is the maximum width for Poplar Strips?,"Poplar Strips can have widths ranging from 2-1/2"" to 6"".",0.9000948289031132
815,What is the standard grade for Clear Poplar Strips?,Clear Poplar Strips should be clear on both faces and have limited airwood.,0.9119659608869749
816,What is the grade of Poplar Strips that allows unlimited airwood?,The grade No. 1 Common of Poplar Strips allows unlimited airwood but with a limitation on defects.,0.9119659608869749
817,What is the requirement for curings in No. 1 Common Poplar Strips?,All curings in No. 1 Common Poplar Strips should be clear on both faces.,0.9135302135165133
818,What is the allowance for mineral stain in FAS Quartered Poplar?,"In FAS Quartered Poplar, mineral stain is allowed without limit.",0.8699860987994823
819,What are some characteristics of Virginia pine?,"Virginia pine is intolerant of shade, has a moderate growth rate, and is a hard pine.",0.9999999999999998
820,How tall does Virginia pine grow?,Virginia pine grows to a height of 40 to 60 feet.,0.9999999999999992
821,What is the diameter of a mature Virginia pine?,A mature Virginia pine attains a diameter of 1 to 1.5 feet.,1.0
822,What is Virginia pine often grown for in the southern states?,Virginia pine is often grown for Christmas trees.,1.0
823,Where is Virginia pine commonly found?,Virginia pine is commonly found in the southeastern United States.,0.9999989380079968
824,What is the scientific name of Virginia pine?,The scientific name of Virginia pine is Pinus virginiana.,1.0000000000000007
825,What is the natural range of Virginia pine?,The natural range of Virginia pine extends from southeastern New York to northern Florida and west to eastern Kentucky and eastern Tennessee.,0.9999999999999991
826,How long does it take for Virginia pine to reach maturity?,Virginia pine takes about 35 to 40 years to reach maturity.,0.9999999999999988
827,What is the primary use of Virginia pine wood?,The primary use of Virginia pine wood is for pulp and pallets.,1.0000000000000009
828,Is Virginia pine an important species for wildlife?,"Yes, Virginia pine provides important cover and food for various wildlife species.",0.9545879634567284
829,What is the unit of measure for board feet?,The unit of measure for board feet is 12 inches wide by 12 inches long and 1 inch thick (144 cubic inches).,0.9457618633302783
830,What does surface measure represent?,Surface measure represents the number of square feet on the surface of a board without regard to thickness.,0.8667701534498011
831,How is board feet calculated?,"Board feet is calculated by multiplying the surface measure by the standard thickness, rounding up or down to the nearest whole number.",0.9457618633302783
832,What is the measurement rule for random width lumber?,"In random width lumber measured with a board rule, fractions of a foot below the half are dropped and fractions of a foot higher than the half are rounded to the next higher whole foot.",0.9076740375584514
833,How are widths measuring to the even half feet counted?,Widths measuring to the even half feet are counted accurately to the next higher or lower foot.,0.8905854581712731
834,What happens to fractions of feet longer than the standard lengths in standard length lumber?,Fractions of feet longer than the standard lengths are dropped to the next lower standard length in standard length lumber.,0.9103464750917631
835,When is board footage measured in surfaced lumber?,Board footage is measured before surfacing in surfaced lumber.,0.901268007325422
836,What does reference to percentages apply to?,Reference to percentages applies to board feet and not to the number of pieces.,0.827682722991329
837,What is end tally measurement?,"End tally measurement is the method of board footage measurement where lumber is tallied on a 12-foot basis, taking width measurements from the ends of boards after the lumber has been stacked in bundles.",0.8776558011570396
838,How is tapering lumber in standard lengths measured?,Tapering lumber in standard lengths is measured one-third the length of the piece from the narrow end for surface measure and to record footage on length and width tallies.,0.9192453245651954
839,What are the grading rules for Colonial Poplar?,The grading rules for Colonial Poplar admit pieces of different sizes to yield a certain percentage of cuttings.,0.8900383895459418
840,How many cuttings are allowed for pieces 2' to 4' in surface measure for Colonial Poplar?,Pieces 2' to 4' in surface measure for Colonial Poplar yield 1 cutting.,0.9635415557447917
841,How many cuttings are allowed for pieces 5' to 7' in surface measure for Colonial Poplar?,Pieces 5' to 7' in surface measure for Colonial Poplar yield 2 cuttings.,0.9635415557447917
842,How many cuttings are allowed for pieces 8' to 10' in surface measure for Colonial Poplar?,Pieces 8' to 10' in surface measure for Colonial Poplar yield 3 cuttings.,0.960090368874183
843,How many cuttings are allowed for pieces 11' to 15' in surface measure for Colonial Poplar?,Pieces 11' to 15' in surface measure for Colonial Poplar yield 4 cuttings.,0.9614053176745947
844,How many cuttings are allowed for pieces 14' and over in surface measure for Colonial Poplar?,Pieces 14' and over in surface measure for Colonial Poplar yield 5 cuttings.,0.9623080677015355
845,What additional cutting is allowed for Rustic Oak compared to Colonial Poplar?,Rustic Oak allows for one additional cutting compared to Colonial Poplar.,0.8687368671429139
846,What are the grading rules for Pacific Coast Red Alder?,Pacific Coast Red Alder lumber allows for the admission of pin knoes and other defects of certain dimensions.,0.8988156879997362
847,What is the maximum dimension allowed for knoes in Pacific Coast Red Alder lumber?,The maximum dimension allowed for knoes in Pacific Coast Red Alder lumber is 1/4 inch.,0.9451220794394514
848,What is the maximum dimension allowed for unround carriers in Pacific Coast Red Alder lumber?,The maximum dimension allowed for unround carriers in Pacific Coast Red Alder lumber is 1/8 inch.,0.9451220794394514
849,What are the allowable defects for forestry boards?,"Allowable defects could be a small (1/2"") sound knot in the center, a crack less than 1/32"" wide and 3"" long, or an unusual knot or crack in the very end of the board that does not exceed more than 2"" into the length of the board.",0.9082583497768628
850,"What are the grades for small, clear mesquite pieces?","The grades for small, clear mesquite pieces are Cif (clear ONE FACE), Cif (clear TWO FACE), Core, Sound INTENTOR, and Sound FRAME.",0.9046135905197541
851,What is required for material to be classified as Cif (clear ONE FACE)?,"Material classified as Cif (clear ONE FACE) must be clear on one side or face, both edges, and both ends. The reverse face may contain defects of sound quality.",0.9630059492114023
852,What is required for material to be classified as Cif (clear TWO FACE)?,"Material classified as Cif (clear TWO FACE) must be clear on both faces, the edges, and the ends. It allows layered, light streaks, small burls or swirls, and light stain.",0.9630059492114023
853,What is required for material to be classified as Core?,"Material classified as Core must be sound on both faces and may have tight sound knots, small worm holes, slight surface checks, or their equivalent.",0.8546642089485659
854,What is required for material to be classified as Sound INTENTOR?,Material classified as Sound INTENTOR may contain any defects that will not necessarily impair the strength of the individual piece for the intended use.,0.8907398005866807
855,What is required for material to be classified as Sound FRAME?,Material classified as Sound FRAME is the same as for Sound INTENTOR.,0.8907398005866807
856,"Without limit, what lengths are admitted for Cidi?",Cidi lengths are admitted without limit.,0.8311453039858573
857,What is not allowed in the cutting on both faces for all grades in Tropicl Hardwoods?,Saproed is not allowed in the cutting on both faces in all grades of Tropicl Hardwoods.,0.902299005836155
858,"What is the percentage of clear face required for pieces of 4"" and 5"" surface measure in FAsi?","Pieces of 4"" and 5"" surface measure in FAsi must yield 11/12 (91-2/3%) clear face in one cutting.",0.8961497839076671
859,What are some characteristics of Virginia pine?,"Virginia pine is intolerant of shade, has a moderate growth rate, and is a hard pine.",0.9999999999999998
860,How tall does Virginia pine grow?,Virginia pine grows to a height of 40 to 60 feet.,0.9999999999999992
861,What is the diameter of a mature Virginia pine?,A mature Virginia pine attains a diameter of 1 to 1.5 feet.,1.0
862,What is Virginia pine often grown for in the southern states?,Virginia pine is often grown for Christmas trees.,1.0
863,What is the scientific name of Virginia pine?,The scientific name of Virginia pine is Pinus virginiana.,1.0000000000000007
864,What is the preferred habitat of Virginia pine?,"Virginia pine is adapted to a wide range of habitats, but it prefers dry, sandy soils.",0.9414771953505531
865,What is the natural range of Virginia pine?,Virginia pine naturally occurs in the southeastern United States.,0.9999999999999991
866,What are the leaves of Virginia pine like?,The leaves of Virginia pine are needle-like and occur in bundles of two.,0.938260642863731
867,What are the cones of Virginia pine like?,"The cones of Virginia pine are small, measuring 1.5 to 2 inches long, and have prickly scales.",0.938260642863731
